{
  "resource_pack_name": "burmaldaholic",
  "texture_name": "atlas.terrain",
  "padding": 8,
  "num_mip_levels": 4,
  "texture_data": {
    "burmaldaholic_casino_charter_top": {
      "textures": "textures/blocks/multiplayer/casino_charter_top"
    },
    "burmaldaholic_casino_charter_side": {
      "textures": "textures/blocks/multiplayer/casino_charter_side"
    },
    "burmaldaholic_casino_charter_bottom": {
      "textures": "textures/blocks/multiplayer/casino_charter_bottom"
    }
  }
}
